{
  "schemaVersion": "luo.miner_submission.v1",
  "challengeId": "LUO-OUSG-XJ-V1",
  "minerHotkey": "5PUBLIC_DEMO_HOTKEY_PLACEHOLDER",
  "question": "Map OUSG eligibility and transfer boundaries across the United States, Hong Kong, Singapore, and the European Union. Preserve divergence; do not convert silence, conditional frameworks, or classification gaps into permission.",
  "requiredJurisdictions": [
    "US",
    "HK",
    "SG",
    "EU"
  ],
  "corpusManifest": {
    "manifestId": "public-demo-ousg-manifest",
    "asOfDate": "2026-06-07",
    "sourceCount": 5,
    "publicNote": "Reviewed source set for the LUO OUSG demo challenge."
  },
  "citations": [
    {
      "sourceId": "ONDO-SRC-01",
      "jurisdiction": "PRODUCT",
      "claimIds": [
        "CLAIM-US-01"
      ]
    },
    {
      "sourceId": "US-SRC-01",
      "jurisdiction": "US",
      "claimIds": [
        "CLAIM-US-01"
      ]
    },
    {
      "sourceId": "HK-SRC-01",
      "jurisdiction": "HK",
      "claimIds": [
        "CLAIM-HK-01"
      ]
    },
    {
      "sourceId": "SG-SRC-01",
      "jurisdiction": "SG",
      "claimIds": [
        "CLAIM-SG-01"
      ]
    },
    {
      "sourceId": "EU-SRC-01",
      "jurisdiction": "EU",
      "claimIds": [
        "CLAIM-EU-01"
      ]
    }
  ],
  "mapClaims": [
    {
      "claimId": "CLAIM-US-01",
      "jurisdiction": "US",
      "claim": "OUSG remains bounded by qualified-access and private-offering constraints.",
      "sourceIds": [
        "ONDO-SRC-01",
        "US-SRC-01"
      ],
      "confidence": "high",
      "notSupported": "This claim does not establish public retail eligibility."
    },
    {
      "claimId": "CLAIM-HK-01",
      "jurisdiction": "HK",
      "claim": "Hong Kong tokenised-product materials preserve conditionality; they do not prove OUSG retail offerability.",
      "sourceIds": [
        "HK-SRC-01",
        "ONDO-SRC-01"
      ],
      "confidence": "medium",
      "notSupported": "This claim does not establish that OUSG is SFC-authorised or retail-distributable."
    },
    {
      "claimId": "CLAIM-SG-01",
      "jurisdiction": "SG",
      "claim": "Singapore source context is narrow and should not be expanded into direct OUSG approval.",
      "sourceIds": [
        "SG-SRC-01"
      ],
      "confidence": "medium",
      "notSupported": "This claim does not establish a general offering route."
    },
    {
      "claimId": "CLAIM-EU-01",
      "jurisdiction": "EU",
      "claim": "EU treatment preserves the MiCA and financial-instrument classification boundary.",
      "sourceIds": [
        "EU-SRC-01"
      ],
      "confidence": "medium",
      "notSupported": "This claim does not resolve product-specific classification."
    }
  ],
  "divergencePairs": [
    {
      "pairId": "PAIR-QUALIFIED-ACCESS-01",
      "factInQuestion": "Can a tokenised treasury product be treated as broadly retail-transferable across jurisdictions?",
      "jurisdictions": [
        "US",
        "HK"
      ],
      "divergenceType": "more_restrictive",
      "sourceIds": [
        "ONDO-SRC-01",
        "US-SRC-01",
        "HK-SRC-01"
      ]
    }
  ],
  "unresolvedGaps": [
    {
      "gapId": "GAP-EU-CLASSIFICATION-01",
      "jurisdiction": "EU",
      "description": "Classification boundary remains unresolved for downstream execution.",
      "requiredNextStep": "Refresh source pack and route to counsel review before execution."
    }
  ]
}